{
  "schema_version": "1.0",
  "dataset_id": "photography-skill-v3",
  "dataset_version": "3.0.0",
  "frozen": true,
  "frozen_at": "2026-07-29T08:20:31.234Z",
  "content_hash": "sha256:bd418dde871fcddc078e5f50810506b44371a3f754aab58eafeefb26f2491944",
  "partitions": {
    "training": [
      "photo-v1-landscape-001",
      "photo-v1-landscape-002",
      "photo-v1-landscape-003",
      "photo-v1-landscape-004",
      "photo-v1-landscape-005",
      "photo-v1-landscape-006",
      "photo-v1-landscape-007",
      "photo-v1-landscape-008",
      "photo-v1-landscape-009",
      "photo-v1-landscape-010",
      "photo-v1-landscape-011",
      "photo-v1-landscape-012",
      "photo-v1-landscape-013",
      "photo-v1-landscape-014",
      "photo-v1-landscape-015",
      "photo-v1-urban-001",
      "photo-v1-urban-002",
      "photo-v1-urban-003",
      "photo-v1-urban-004",
      "photo-v1-urban-005",
      "photo-v1-urban-006",
      "photo-v1-urban-007",
      "photo-v1-urban-008",
      "photo-v1-urban-009",
      "photo-v1-portrait-001",
      "photo-v1-portrait-002",
      "photo-v1-portrait-003",
      "photo-v1-portrait-004",
      "photo-v1-portrait-005",
      "photo-v1-portrait-006",
      "photo-v1-difficult-001",
      "photo-v1-difficult-002",
      "photo-v1-difficult-003",
      "photo-v1-difficult-004",
      "photo-v1-difficult-005",
      "photo-v1-difficult-006"
    ],
    "regression": [
      "photo-v1-landscape-016",
      "photo-v1-landscape-017",
      "photo-v1-landscape-018",
      "photo-v1-landscape-019",
      "photo-v1-landscape-020",
      "photo-v1-urban-010",
      "photo-v1-urban-011",
      "photo-v1-urban-012",
      "photo-v1-portrait-007",
      "photo-v1-portrait-008",
      "photo-v1-difficult-007",
      "photo-v1-difficult-008"
    ],
    "holdout": [
      "photo-v3-landscape-001",
      "photo-v3-landscape-002",
      "photo-v3-landscape-003",
      "photo-v3-landscape-004",
      "photo-v3-landscape-005",
      "photo-v3-urban-001",
      "photo-v3-urban-002",
      "photo-v3-urban-003",
      "photo-v3-portrait-001",
      "photo-v3-portrait-002",
      "photo-v3-difficult-001",
      "photo-v3-difficult-002"
    ]
  }
}
